{
  "schemaVersion": "1.0.0",
  "id": "ai-workspace-tools-small-business-review",
  "type": "review",
  "status": "draft",
  "metadata": {
    "title": "Tested AI Workspaces for Small Businesses: Privacy & Security Evaluation",
    "description": "An objective editorial comparison of commercial AI workspace tiers evaluated for zero-data retention, administrative security, and local team usability.",
    "category": "Reviews & Comparisons",
    "industry": "general",
    "difficulty": "beginner",
    "readingTime": 6,
    "publishedAt": null,
    "updatedAt": "2026-08-10T10:30:00Z"
  },
  "author": {
    "id": "locatria-editorial-team",
    "name": "Locatria Editorial Team",
    "role": "Small Business Software Evaluator"
  },
  "seo": {
    "title": "Tested AI Workspaces for Small Businesses: Privacy Evaluation | Locatria",
    "description": "Editorial evaluation of commercial AI workspace plans for small local businesses prioritizing data privacy.",
    "canonical": "https://locatria.com/knowledge/ai-workspace-tools-small-business-review",
    "robots": "index,follow"
  },
  "geo": {
    "primaryTopic": "Small Business AI Software Privacy",
    "audience": [
      "Small Business Owners",
      "SMB Operations Managers",
      "Solopreneurs"
    ],
    "industries": [
      "Local Services",
      "Professional SMBs"
    ],
    "entities": [
      "Zero Data Retention",
      "AI Workspace Security",
      "Business Associate Agreement"
    ]
  },
  "content": [
    {
      "type": "keyTakeaways",
      "id": "key-takeaways",
      "title": "Key Evaluation Findings",
      "items": [
        "Free consumer AI plans train public models on your conversation data by default.",
        "Commercial team tiers provide centralized admin panels to manage staff access and toggle zero-data retention.",
        "Choose software based on data security compliance rather than raw prompt capability alone."
      ]
    },
    {
      "type": "heading",
      "level": 2,
      "id": "evaluation-criteria",
      "title": "1. Small Business Evaluation Criteria"
    },
    {
      "type": "paragraph",
      "content": "When local business owners adopt AI software, data privacy and admin controls are paramount. Our team evaluated commercial workspace options against 3 core operational criteria: data privacy, ease of staff deployment, and monthly overhead."
    },
    {
      "type": "heading",
      "level": 2,
      "id": "comparison-matrix",
      "title": "2. Workspace Feature Comparison Table"
    },
    {
      "type": "comparisonTable",
      "columns": [
        "Free Consumer Tier",
        "Commercial Team Tier"
      ],
      "rows": [
        {
          "criteria": "Data Privacy Default",
          "values": [
            "Opt-out required / Model training ON",
            "Zero Data Retention (ZDR) ON"
          ]
        },
        {
          "criteria": "Admin Access Controls",
          "values": [
            "Individual accounts only",
            "Centralized team console"
          ]
        },
        {
          "criteria": "Cost Model",
          "values": [
            "Free ($0)",
            "$20 - $30 / user / month"
          ]
        }
      ]
    },
    {
      "type": "heading",
      "level": 2,
      "id": "pros-cons-analysis",
      "title": "3. Commercial Team Workspace Pros & Cons"
    },
    {
      "type": "prosCons",
      "pros": [
        "Guaranteed zero-data retention on business conversations",
        "Centralized seat management for staff",
        "Shared prompt libraries across office team"
      ],
      "cons": [
        "Requires monthly subscription fee per user seat",
        "Requires initial staff security training"
      ]
    },
    {
      "type": "heading",
      "level": 2,
      "id": "recommended-tool",
      "title": "4. Editorial Recommendation"
    },
    {
      "type": "recommendedTool",
      "tool": {
        "name": "ChatGPT Team Edition",
        "url": "https://openai.com"
      },
      "bestFor": "Small local teams needing workspace privacy guardrails.",
      "whyRecommended": "Enforces zero-data retention by default on workspace prompts and provides centralized user seat administration.",
      "cta": "Explore ChatGPT Team →"
    },
    {
      "type": "affiliateDisclosure"
    }
  ],
  "relationships": {
    "relatedArticles": [
      "ai-patient-intake-dental-clinics",
      "ai-local-seo-real-estate-guide"
    ],
    "relatedGuides": [
      "small-business-ai-fundamentals-track"
    ],
    "previous": "evaluating-ai-privacy-policies",
    "next": "setting-up-team-prompt-libraries"
  }
}